{
  "format_version": 2,
  "description": "Shared, language-neutral triage test table (rules 0.2.0, ADR 014). Run by pytest (backend/triage) and Jest (app). Expected values were authored by the engineering team and are NOT clinically graded.",
  "graded_by_drg_note": "No case is graded by a dentist yet (graded_by_drg=false for all). The >= 30 dentist-graded cases requirement is NOT met; no clinical claim may be made.",
  "rules_file": "../rules.yaml (TS: ../dist/rules.json)",
  "params_profiles_file": "fixtures/params_profiles.json",
  "how_to_run": "For each case: params = resolve_params(rules, profiles[input.params_profile].values); call evaluate(rules, input without params_profile, params); compare expected.level, reasons ids (ordered), advice_ids (ordered), referral_template_id, and expected.lesions (listed keys only), or expect a TriageInputError with expected.error_code.",
  "cases": [
    {
      "id": "RF-01",
      "description": "Tanda bahaya sendirian (sulit menelan/bernapas); alur berhenti, foto tidak diambil",
      "tags": [
        "red_flag",
        "alone"
      ],
      "input": {
        "detections": [],
        "photo_status": "not_taken",
        "symptoms": {
          "airway_or_swallowing": "yes",
          "lethargy": "no",
          "trismus": "no",
          "facial_swelling": "no",
          "fever_with_toothache": "no",
          "pus_or_fistula": "no",
          "dental_trauma": "no",
          "night_pain": "no",
          "white_spot": "no"
        },
        "age_months": 96,
        "pain": 0,
        "params_profile": "test"
      },
      "expected": {
        "level": "emergency",
        "reasons_ids": [
          "RF_AIRWAY_OR_SWALLOWING",
          "CTX_PHOTO_NOT_ASSESSED"
        ],
        "advice_ids": [
          "ADV_EMERGENCY_NOW",
          "ADV_FASKES_TODAY",
          "ADV_DISCLAIMER_NOT_DIAGNOSIS",
          "ADV_REFERRAL_CTA"
        ],
        "referral_template_id": "REF_EMERGENCY"
      },
      "graded_by_drg": false
    },
    {
      "id": "RF-02",
      "description": "Tanda bahaya sendirian (sangat lemas); alur berhenti, foto tidak diambil",
      "tags": [
        "red_flag",
        "alone"
      ],
      "input": {
        "detections": [],
        "photo_status": "not_taken",
        "symptoms": {
          "airway_or_swallowing": "no",
          "lethargy": "yes",
          "trismus": "no",
          "facial_swelling": "no",
          "fever_with_toothache": "no",
          "pus_or_fistula": "no",
          "dental_trauma": "no",
          "night_pain": "no",
          "white_spot": "no"
        },
        "age_months": 96,
        "pain": 0,
        "params_profile": "test"
      },
      "expected": {
        "level": "emergency",
        "reasons_ids": [
          "RF_LETHARGY",
          "CTX_PHOTO_NOT_ASSESSED"
        ],
        "advice_ids": [
          "ADV_EMERGENCY_NOW",
          "ADV_FASKES_TODAY",
          "ADV_DISCLAIMER_NOT_DIAGNOSIS",
          "ADV_REFERRAL_CTA"
        ],
        "referral_template_id": "REF_EMERGENCY"
      },
      "graded_by_drg": false
    },
    {
      "id": "RF-03",
      "description": "Tanda bahaya sendirian (sulit membuka mulut); alur berhenti, foto tidak diambil",
      "tags": [
        "red_flag",
        "alone"
      ],
      "input": {
        "detections": [],
        "photo_status": "not_taken",
        "symptoms": {
          "airway_or_swallowing": "no",
          "lethargy": "no",
          "trismus": "yes",
          "facial_swelling": "no",
          "fever_with_toothache": "no",
          "pus_or_fistula": "no",
          "dental_trauma": "no",
          "night_pain": "no",
          "white_spot": "no"
        },
        "age_months": 96,
        "pain": 0,
        "params_profile": "test"
      },
      "expected": {
        "level": "emergency",
        "reasons_ids": [
          "RF_TRISMUS",
          "CTX_PHOTO_NOT_ASSESSED"
        ],
        "advice_ids": [
          "ADV_EMERGENCY_NOW",
          "ADV_FASKES_TODAY",
          "ADV_DISCLAIMER_NOT_DIAGNOSIS",
          "ADV_REFERRAL_CTA"
        ],
        "referral_template_id": "REF_EMERGENCY"
      },
      "graded_by_drg": false
    },
    {
      "id": "RF-04",
      "description": "Tanda bahaya sendirian (bengkak wajah); alur berhenti, foto tidak diambil",
      "tags": [
        "red_flag",
        "alone"
      ],
      "input": {
        "detections": [],
        "photo_status": "not_taken",
        "symptoms": {
          "airway_or_swallowing": "no",
          "lethargy": "no",
          "trismus": "no",
          "facial_swelling": "yes",
          "fever_with_toothache": "no",
          "pus_or_fistula": "no",
          "dental_trauma": "no",
          "night_pain": "no",
          "white_spot": "no"
        },
        "age_months": 96,
        "pain": 0,
        "params_profile": "test"
      },
      "expected": {
        "level": "emergency",
        "reasons_ids": [
          "RF_FACIAL_SWELLING",
          "CTX_PHOTO_NOT_ASSESSED"
        ],
        "advice_ids": [
          "ADV_FASKES_TODAY",
          "ADV_DISCLAIMER_NOT_DIAGNOSIS",
          "ADV_REFERRAL_CTA"
        ],
        "referral_template_id": "REF_EMERGENCY"
      },
      "graded_by_drg": false
    },
    {
      "id": "RF-05",
      "description": "Tanda bahaya sendirian (demam + sakit gigi); alur berhenti, foto tidak diambil",
      "tags": [
        "red_flag",
        "alone"
      ],
      "input": {
        "detections": [],
        "photo_status": "not_taken",
        "symptoms": {
          "airway_or_swallowing": "no",
          "lethargy": "no",
          "trismus": "no",
          "facial_swelling": "no",
          "fever_with_toothache": "yes",
          "pus_or_fistula": "no",
          "dental_trauma": "no",
          "night_pain": "no",
          "white_spot": "no"
        },
        "age_months": 96,
        "pain": 0,
        "params_profile": "test"
      },
      "expected": {
        "level": "emergency",
        "reasons_ids": [
          "RF_FEVER_WITH_TOOTHACHE",
          "CTX_PHOTO_NOT_ASSESSED"
        ],
        "advice_ids": [
          "ADV_FASKES_TODAY",
          "ADV_DISCLAIMER_NOT_DIAGNOSIS",
          "ADV_REFERRAL_CTA"
        ],
        "referral_template_id": "REF_EMERGENCY"
      },
      "graded_by_drg": false
    },
    {
      "id": "RF-06",
      "description": "Tanda bahaya sendirian (nanah/fistula); alur berhenti, foto tidak diambil",
      "tags": [
        "red_flag",
        "alone"
      ],
      "input": {
        "detections": [],
        "photo_status": "not_taken",
        "symptoms": {
          "airway_or_swallowing": "no",
          "lethargy": "no",
          "trismus": "no",
          "facial_swelling": "no",
          "fever_with_toothache": "no",
          "pus_or_fistula": "yes",
          "dental_trauma": "no",
          "night_pain": "no",
          "white_spot": "no"
        },
        "age_months": 96,
        "pain": 0,
        "params_profile": "test"
      },
      "expected": {
        "level": "emergency",
        "reasons_ids": [
          "RF_PUS_OR_FISTULA",
          "CTX_PHOTO_NOT_ASSESSED"
        ],
        "advice_ids": [
          "ADV_FASKES_TODAY",
          "ADV_DISCLAIMER_NOT_DIAGNOSIS",
          "ADV_REFERRAL_CTA"
        ],
        "referral_template_id": "REF_EMERGENCY"
      },
      "graded_by_drg": false
    },
    {
      "id": "RF-07",
      "description": "Tanda bahaya sendirian (trauma gigi); alur berhenti, foto tidak diambil",
      "tags": [
        "red_flag",
        "alone"
      ],
      "input": {
        "detections": [],
        "photo_status": "not_taken",
        "symptoms": {
          "airway_or_swallowing": "no",
          "lethargy": "no",
          "trismus": "no",
          "facial_swelling": "no",
          "fever_with_toothache": "no",
          "pus_or_fistula": "no",
          "dental_trauma": "yes",
          "night_pain": "no",
          "white_spot": "no"
        },
        "age_months": 96,
        "pain": 0,
        "params_profile": "test"
      },
      "expected": {
        "level": "emergency",
        "reasons_ids": [
          "RF_DENTAL_TRAUMA",
          "CTX_PHOTO_NOT_ASSESSED"
        ],
        "advice_ids": [
          "ADV_FASKES_TODAY",
          "ADV_DISCLAIMER_NOT_DIAGNOSIS",
          "ADV_REFERRAL_CTA"
        ],
        "referral_template_id": "REF_EMERGENCY"
      },
      "graded_by_drg": false
    },
    {
      "id": "RF-08",
      "description": "Tanda bahaya (sulit menelan/bernapas) + 3 temuan karies + nyeri 10 + nyeri malam: tanda bahaya tetap menang",
      "tags": [
        "red_flag",
        "combination"
      ],
      "input": {
        "detections": [
          {
            "class": "caries_permanent",
            "confidence": 0.9
          },
          {
            "class": "caries_permanent",
            "confidence": 0.9
          },
          {
            "class": "caries_primary",
            "confidence": 0.8
          }
        ],
        "photo_status": "assessed",
        "symptoms": {
          "airway_or_swallowing": "yes",
          "lethargy": "no",
          "trismus": "no",
          "facial_swelling": "no",
          "fever_with_toothache": "no",
          "pus_or_fistula": "no",
          "dental_trauma": "no",
          "night_pain": "yes",
          "white_spot": "no"
        },
        "age_months": 96,
        "pain": 10,
        "params_profile": "test"
      },
      "expected": {
        "level": "emergency",
        "reasons_ids": [
          "RF_AIRWAY_OR_SWALLOWING",
          "SYM_NIGHT_PAIN",
          "PAIN_HIGH",
          "DET_CARIES_PERMANENT",
          "DET_CARIES_PRIMARY",
          "DET_CARIES_MANY"
        ],
        "advice_ids": [
          "ADV_EMERGENCY_NOW",
          "ADV_FASKES_TODAY",
          "ADV_PHOTO_LIMITATION",
          "ADV_DISCLAIMER_NOT_DIAGNOSIS",
          "ADV_REFERRAL_CTA"
        ],
        "referral_template_id": "REF_EMERGENCY",